{
  "$id": "https://example.org/schemas/user-profile.json",
  "$schema": "http://json-schema.org/draft-07/schema#",
  "title": "User Profile",
  "type": "object",
  "properties": {
    "userId": { "type": "string" },
    "name": {
      "type": "object",
      "properties": {
        "first": { "type": "string" },
        "last": { "type": "string" }
      },
      "required": ["first", "last"]
    },
    "email": { "type": "string", "format": "email" },

    "billingAddress": {
      "type": "object",
      "properties": {
        "street": { "type": "string" },
        "city": { "type": "string" },
        "zip": { "type": "string" },
        "country": { "type": "string" }
      },
      "required": ["street", "city", "zip", "country"]
    },

    "shippingAddress": {
      "type": "object",
      "properties": {
        "street": { "type": "string" },
        "city": { "type": "string" },
        "zip": { "type": "string" },
        "country": { "type": "string" }
      },
      "required": ["street", "city", "zip", "country"]
    },

    "supplierProfile": {
      "type": "object",
      "properties": {
        "companyName": { "type": "string" },
        "address": {
          "type": "object",
          "properties": {
            "street": { "type": "string" },
            "city": { "type": "string" },
            "zip": { "type": "string" },
            "country": { "type": "string" }
          },
          "required": ["street", "city", "zip", "country"]
        }
      },
      "required": ["companyName", "address"]
    }
  },
  "required": ["userId", "name", "email", "billingAddress", "shippingAddress"]
}
